{"$schema":"https://json-schema.org/draft/2020-12/schema","$id":"https://schemas.llmwiki.org/agent-wiki/v1/template-manifest.schema.json","type":"object","required":["schemaVersion","manifestId","source","template","home","components","diagnostics","provenance","fingerprint"],"additionalProperties":false,"properties":{"schemaVersion":{"const":1},"manifestId":{"$ref":"common.schema.json#/$defs/identifier"},"source":{"$ref":"#/$defs/file"},"template":{"$ref":"#/$defs/file"},"home":{"type":"object","required":["path","dashboard"],"additionalProperties":false,"properties":{"path":{"$ref":"#/$defs/path"},"dashboard":{"type":"object","required":["layout","componentIds"],"additionalProperties":false,"properties":{"layout":{"enum":["grid","tabs","stack"]},"componentIds":{"type":"array","items":{"$ref":"common.schema.json#/$defs/identifier"},"uniqueItems":true}}}}},"components":{"type":"array","items":{"type":"object","required":["id","type"],"additionalProperties":false,"properties":{"id":{"$ref":"common.schema.json#/$defs/identifier"},"type":{"enum":["multi","data-view","form","card","count","markdown","time"]},"title":{"type":"string"},"layout":{"type":"object","additionalProperties":false,"properties":{"mobile":{"$ref":"#/$defs/layout"},"laptop":{"$ref":"#/$defs/layout"}}},"children":{"type":"array","items":{"$ref":"common.schema.json#/$defs/identifier"},"uniqueItems":true},"fields":{"type":"array","items":{"$ref":"#/$defs/field"}},"actions":{"type":"array","items":{"$ref":"#/$defs/action"}}}}},"diagnostics":{"type":"array","items":{"$ref":"#/$defs/diagnostic"}},"provenance":{"type":"object","required":["origin"],"additionalProperties":false,"properties":{"origin":{"enum":["external-observation","native-export","user-authored"]},"sourceUrl":{"type":"string","pattern":"^https://"},"release":{"type":"string"}}},"fingerprint":{"$ref":"#/$defs/digest"}},"$defs":{"path":{"type":"string","minLength":1,"pattern":"^(?!/)(?![A-Za-z]:)(?![A-Za-z][A-Za-z0-9+.-]*:)(?!.*(?:^|/)\\.\\.(?:/|$))(?!.*[\\r\\n])[^\\u0000\\\\]+$"},"digest":{"type":"string","pattern":"^[a-f0-9]{64}$"},"file":{"type":"object","required":["path","sha256"],"additionalProperties":false,"properties":{"path":{"$ref":"#/$defs/path"},"sha256":{"$ref":"#/$defs/digest"}}},"layout":{"type":"object","required":["x","y","w","h"],"additionalProperties":false,"properties":{"x":{"type":"integer","minimum":0},"y":{"type":"integer","minimum":0},"w":{"type":"integer","minimum":0},"h":{"type":"integer","minimum":0}}},"field":{"type":"object","required":["id","label","type","property"],"additionalProperties":false,"properties":{"id":{"$ref":"common.schema.json#/$defs/identifier"},"label":{"type":"string","minLength":1},"type":{"enum":["text","number","date","select","checkbox"]},"property":{"$ref":"common.schema.json#/$defs/identifier"},"options":{"type":"array","items":{"type":"string"}}}},"scalar":{"type":["string","number","boolean","null"]},"action":{"oneOf":[{"type":"object","required":["kind","templatePath","targetFolder","fileName"],"additionalProperties":false,"properties":{"kind":{"const":"create-file"},"templatePath":{"$ref":"#/$defs/path"},"targetFolder":{"$ref":"#/$defs/path"},"fileName":{"type":"string","minLength":1}}},{"type":"object","required":["kind","property","value"],"additionalProperties":false,"properties":{"kind":{"const":"update-property"},"property":{"$ref":"common.schema.json#/$defs/identifier"},"value":{"$ref":"#/$defs/scalar"}}},{"type":"object","required":["kind","path"],"additionalProperties":false,"properties":{"kind":{"const":"open-file"},"path":{"$ref":"#/$defs/path"}}},{"type":"object","required":["kind","commandId"],"additionalProperties":false,"properties":{"kind":{"const":"call-command"},"commandId":{"$ref":"common.schema.json#/$defs/identifier"}}}]},"diagnostic":{"type":"object","required":["kind","code","message"],"additionalProperties":false,"properties":{"kind":{"enum":["unsupported","ambiguous","warning"]},"code":{"$ref":"common.schema.json#/$defs/identifier"},"message":{"type":"string","minLength":1},"componentId":{"$ref":"common.schema.json#/$defs/identifier"},"evidence":{"type":"array","minItems":1,"items":{"type":"string","minLength":1}}},"allOf":[{"if":{"properties":{"kind":{"enum":["unsupported","ambiguous"]}}},"then":{"required":["evidence"]}}]}}}